,0
2593,"틀어 올린 흑발, 가늘고 짙은 눈썹에 언뜻 보이는 붉은 입술, 그리고 풍만한 몸매."
2594,"하녀답지 않은 도도함과 약간의 귀티가 묻어있긴 했지만 흰색 블라우스에 민무늬 잿빛 스커트, 그리고 손에 든 젖은 걸레까지."
2595,위로 보나 아래로 보나 그녀는 영락없는 공작성의 하녀였다.
2596,"그런데 왜? 아니, 어떻게?"
2597,"그녀는 이토록 나를, 이 공작성의 안주인을 무시할 수가 있는 거지?"
2598,“보니타? 혹시 예전에 너와 내가 안면이 있었니?”
2599,"“... 일전에 별채 식당에서 한 번, 그리고 지금이 두 번째입니다.”"
2600,“그러니까 우리가 따로 인연이 있거나 대화를 나누어 본 사이는 아니라는 거구나. 그렇지?”
2601,“... 예. 그러합니다 마님.”
2602,내가 꼭 집어 자신에게 말을 걸자 살짝 숙였던 고개를 들어 답을 하는 보니타의 표정이 당황으로 물들어 있었다.
2603,"어이쿠, 근데 이걸 어쩌니."
2604,"난 이미 다 봤단다, 아까 네 그 싸가지 없는 표정."
2605,내가 진상 슈퍼 갑 질 다음으로 싫어하는 게 예의를 밥 말아 먹은 건데 말이지.
2606,널 어떻게 하면 좋을까?
2607,^^^
2608,작업의 기술
2609,
2610,"“에휴, 내가 그 입 나불거릴 때부터 알아 봤어."
2611,제 무덤 제 손으로 판 거지 뭐.
2612,그러게 보니타 넌 측근시녀를 했던 적도 없으면서 왜 그렇게 마님을 못 씹어서 안달이...”
2613,"“루시, 제발 그만 좀 해에!”"
2614,"“악! 아파, 아프다고 메리!!”"
2615,옆구리를 꼬집힌 루시가 엄살 섞인 호들갑을 떨어댔지만 메리는 아랑곳하지 않고 꼬집었던 곳을 재차 꼬집으며 작고 낮은 목소리로 말을 이었다.
2616,“네가 어디 남의 입 가지고 충고할 입장이야?
2617,"평소 네 입단속이나 잘 하고, 지금은 제발 눈치껏 좀 가만히 있으란 말이야!"
2618,네가 자꾸 그러면 별채 붙박이로 차출된 보니타에게 염장 질 하는 거 밖에 더 돼?
2619,대체 그 놈의 빠른 눈치는 필요할 때는 안 꺼내고 왜 쓸데없는 데만 꺼내 쓰는 거니!”
2620,둘이 자신을 두고 투덕거리던 말던 보니타는 관심이 없었다.
2621,그저 중앙계단 너머 외성 쪽을 향해 멀어져가는 로즐린의 뒷모습을 계단 가장자리에 서서 뚫어져라 바라보고 있을 뿐이었다.
2622,‘제까짓 게 운이 좋아 후작가에서 태어난 거 빼고는 나보다 잘난 게 뭐가 있다고! 자기 부모한테서조차 버림받은 반편이 주제에.’
2623,따로 안면이 없다더니.
2624,"사실 보니타는 이곳 공작성 내에서 로즐린이 공작부인이 되기 전, 그러니까 테레지아 후작가의 영애였던 시절을 알고 있는 유일한 사람이었다."
2625,하지만 이를 알고 있는 사람은 없었다.
2626,적어도 이 공작성 내에서는.
2627,어느새 로즐린 일행이 사라지고 이젠 아무도 없는 중앙계단이었지만 보니타는 시선을 거두지 않았다.
2628,‘기억을 잃었다고 본인이 새로 태어나기라도 한 것처럼 우아 떠는 꼬락서니라니. 그래봤자 그 비루했던 과거가 없어지는 것도 아닌데.
2629,그깟 밥 몇 끼 같이 먹고 꽃다발 하나 받았다고 진짜 전하의 마음을 얻었다고 착각이라도 하는 거야?
2630,"하, 웃겨 진짜.’"
2631,"이를 앙다문 그녀의 시선, 그 허공을 향한 시선에 묻어나는 감정은 마님을 향한 하녀의 선망 섞인 질투 따위가 결코 아니었다."
2632,"그보다 더 어둡고 진득한, 분노 섞인 증오였다."
2633,‘곁에 두고 괴롭히면서 내 피를 말리려는 속셈인가본데 내가 그딴 짓거리에 굴복이라도 할 줄 알고?
2634,하! 내가 지금껏 어떻게 살아남았는데!
2635,신경질적인 귀족마님 상대하는 것쯤이야 일도 아니지.
2636,"1년, 딱 1년이면 다 끝이야."
2637,"그 잘난 친정가문의 이름값이 떨어져나가도 지금처럼 고개 빳빳이 쳐들고 다닐 수 있을지, 어디 한 번 두고 보자고.’"
2638,"자신이 예견하고 있는 그 날이 오면, 분명히 전하께서는 지금의 공작부인이 아닌 자신을 돌아봐 주시리라."
2639,그렇게 굳게 믿고 있는 보니타였다.
2640,* * *
2641,“이야! 이야!”
2642,"“3열, 5열 다시!”"
2643,“하압! 하압!”
2644,연무장이 한 눈에 내려다보이는 입구 쪽 단상.
2645,해 질 녘이라 날씨는 선선했지만 웃통을 모두 벗어젖히고 선창자의 구령에 맞춰 목검을 휘두르고 있는 기사들의 몸은 온통 땀으로 번들거리고 있었다.
2646,그런데 그 모습이 참... 끝내줬다.
2647,"어머, 어쩜."
2648,"화가 많이 났네, 많이 났어."
2649,"아주 그냥 삼각근, 승모근, 광배근 애들이 전부 화가 많이 났어요."
2650,보는 사람 빠져들게.
2651,한창 훈련 중인 남편 씨와 기사들을 구경하는 재미가 아주 쏠쏠했다.
2652,"“마님, 저기 맨 앞에 계신 분이 전하이신 것 같아요."
2653,그리고 그 바로 뒤는 예르딘 경인 것 같고요.”
2654,"“그래, 그렇구나. 내 눈에도 그리 보여.”"
2655,오늘이 한 달에 한 번 있는 기사단 전체 훈련일이라 부단장인 예르딘도 오늘 오후는 내 호위를 쉬고 훈련에 참석했다.
2656,그래서 예르딘 대신 오늘 내 호위를 맡은 다른 기사가 별채에서 본성까지 나를 데려다주었다.
2657,굳이 그러지 않아도 되는데.
2658,남편 씨는 아직도 내가 사고 칠까봐 걱정되는 모양이었다.
2659,어디 보자~
2660,저기 수많은 성난 근육들 중에서도 단연 빛을 발하고 있는 우리 남편 씨.
2661,멀리서 봐도 잘생겼다.
2662,자꾸 봐도 잘생겼다.
2663,그런데 그게 좋으면서도 한편으로 짜증도 좀 났다.
2664,저런 남자를 매번 심우르르쾅쾅하게 만들려면 어찌해야 하나.
2665,조만간 변신술이라도 배워야 하나.
2666,"“마님, 준비해 온 것들을 지금 저 아래로 내릴까요?”"
2667,"“아니, 곧 훈련이 끝날 것 같으니 조금만 더 기다려보고.”"
2668,"레아야, 우리가 지금 내려가면 훈련이 파토 나잖니."
2669,그러면 좋은 구경도 끝이란다.
2670,"그러니 조금만 더 보고 내려가자, 응?"
2671,"“저, 그런데 마님.”"
2672,"아, 맞다."
2673,여기 지금 레아랑 나만 있는 게 아니었지?
2674,흐흠. 흠. 표정 관리.
2675,"“알베르, 내게 무슨 할 말이 있나요?”"
2676,"“다름이 아니오라 아까 그 아이를 왜 굳이 곁에 두시려는지, 여쭤 봐도 되겠습니까?”"
2677,“보니타 말인가요?”
2678,“예. 그 아이가 이곳에서 일한지 한 3년쯤 되었습니다.
2679,일머리가 제법 좋은 편이라 한 때 눈여겨 본 적도 있었지만...
2680,"제가 그간 지켜본 바, 마님께서 곁에 두시기에 적절한 성품과 능력을 갖춘 이는 아닙니다."
2681,좀 전에 행실만 보아도 그러하지요.”
2682,“그건 나도 알아요.
2683,대충 봐도 하녀로 있기에는 좀... 부적절한 아이였죠.”
2684,좀이 아니라 아주 많이.
2685,“헌데 어찌...”
2686,"“알베르, 뭔가 오해가 있는 것 같군요."
2687,난 보니타를 별채로 보내달라고 했지 내 곁에 둔다고는 하지 않았어요.”
2688,“2층 전담 하녀로 쓴다 하지 않으셨습니까?”
2689,“맞아요. 별채 2층 전담.
2690,그리고 난 이번 주 중에 별채를 떠나 본성의 내 처소로 거처를 옮길 예정이죠.”
2691,보니타가 내게 불손한 언행과 행동을 보였지만 나는 현재 그녀를 체벌하거나 공작성 바깥으로 쫓아낼 수 없는 상황이었다.
2692,그 이유가 뭐가 됐든 사고가 잠잠해지자마자 불쌍한 하녀나 괴롭힌다고 좋지 않은 소문이 흘러나올 게 뻔했기 때문이었다.
2693,"역시 사람 본성은 쉽게 바뀌지 않는 거라는 둥, 말들이 많을 테지."
2694,게다가 보니타가 남편 씨에게 흑심이 있다는 걸 아는 사람이 과연 한 명도 없을까?
2695,어쩌면 투기심을 이기지 못한 마님이 예쁘장한 하녀 하나 골로 보냈다는 소문이 떠돌지도 몰랐다.
2696,“별채 2층 룸의 유지 및 관리.
2697,그게 내가 보니타에게 내리는 벌이에요.
2698,"딱 봐도 허영심이 있어 보이던데, 인적 드문 조용한 곳에서 자신의 잘못을 되돌아보는 시간을 갖는 것도 그 아이에게 나쁠 것 없겠죠.”"
2699,"한 마디로 격리조치, 혹은 귀양이라고 할 수 있었다."
2700,"지금이야 내가 있으니까 본성 사람들도 드나들고 하는 거지 원래 별채에서 일하는 사람은 정원관리사와 마구간지기, 그리고 일주일에 한 번씩 청소 지원을 하러 오는 남자 하인 몇이 전부였다고 했다."
2701,“아무래도 제가 마님의 행사에 주제넘은 참견을 한듯합니다.
2702,"송구합니다, 마님.”"
2703,“아니에요. 알베르가 날 걱정해서 한 말이란 걸 알아요.
2704,그러니 그런 말은 마세요.”
2705,“... 예. 그럼 앞서 명하신 것은 그럼 그리 알고 처리토록 하겠습니다.
2706,그리고 본성으로 옮기시는 건 이번 주 언제로 준비하올까요?”
2707,“그건 내일이나 모레쯤으로 생각하고 있는데 날짜가 결정되면 레아를 통해서 미리 알베르에게 전하도록 할게요.”
2708,원래의 내 설계대로라면 한 달 정도는 더 별채에서 지내려고 했었다.
2709,"결혼 전 서로의 집을 오가며 데이트를 하는, 뭐 그런 느낌을 살려보려는 의도였다."
2710,하지만 어젯밤 남편 씨와의 그 진득했던 긴장감을 겪고 나니 생각이 달라졌다.
2711,삼겹살도 불판이 달궈졌을 때를 놓치지 않고 끊기지 않게 계속 구워야 제맛인 것처럼 사랑의 설렘 혹은 심장의 두근거림도 끊기지 않게 계속 부채질해야만 뭐가 되도 되는 거였다.
2712,"아니면 그냥 썸 타고 마는, 이도 저도 아닌 관계가 될 확률이 높았다."
2713,그래서 나는 이제부터 남편 씨 앞에 수시로 알짱거릴 예정이었다.
2714,"“마님, 훈련이 끝나려나 봅니다."
2715,기사님들이 대열을 정리하는데요.”
2716,"“그래, 그럼 이제 내려가 보자.”"
2717,나는 단상의 계단을 내려가 기사들이 도열한 곳으로 걸음을 옮겼다.
2718,시꺼먼 남자들이 한데뭉친 쪽에 다가갈수록 진한 땀 냄새가 코를 찔렀다.
2719,멀리서 볼 때는 참 은혜롭기만 했는데...
2720,"하지만 이 정도도 못 참으면 오늘의 컨셉, 내조의 여왕은 성공할 수 없었다."
2721,“어? 어... 누구...”
2722,“혹시... 마님?”
2723,“뭐? 에이 설마.”
2724,흙바닥의 연무장을 가로지르는 나를 보고 저쪽에서 기사들이 웅성거리기 시작했다.
2725,저들 대부분은 아마 내 얼굴을 오늘 처음 보는 걸 테지.
2726,너무 튀지 않게 소량으로 피부 결을 마무리한 진주 펄 파우더가 저들에게도 효과가 있었으면 좋겠다.
2727,웅성거리는 소리에 윗옷을 입다 고개를 돌린 남편 씨와 눈이 마주쳤다.
2728,아주 미세한 표정 변화였지만 분명 남편 씨는 나를 보고 놀란 것 같았다.
2729,입던 옷을 마저 입더니 긴 다리를 뻗어 내 쪽으로 성큼성큼 걸어왔다.
2730,"“로즐린, 당신이 여긴 어쩐 일이지?”"
2731,“그걸 몰라 물으세요? 당연히 당신 보러 왔죠.”
2732,눈꼬리가 반달로 내려가는지 의식하며 오는 내내 연습했던 눈웃음을 지었다.
2733,그런데 남편 씨가 별 반응이 없었다.
2734,웃는 얼굴에 침 못 뱉는다는 말도 있는데 사람 민망하게시리.
2735,"어떻게, 좀 같이 좀 웃어주면 안되겠니?"
2736,* * *
2737,“그걸 몰라 물으세요? 당연히 당신 보러 왔죠.”
2738,나를 보러 왔다고?
2739,자신을 향해 환하게 웃어 보이는 아내의 모습에 순간 멈칫했다.
2740,“무슨 일 있나?”
2741,내가 선택한 가장 무난한 대꾸였다.
2742,“무슨 일은요. 그냥 아침에 받은 꽃다발에 대한 답례도 하고 당신 얼굴도 볼 겸 겸사겸사 온 거예요.
2743,"아참, 레아야! 그 바구니 좀 이리 가져와주련."
2744,그리고 알베르는 저 쪽 기사 분들에게 준비해 온 걸 나누어 주도록 하세요.”
2745,"“예, 마님.”"
2746,아내는 시녀가 들고 온 바구니를 열더니 안에 든 것들을 꺼내어 내게 내밀었다.
2747,"“여기 수건, 그리고 이건 이온음료예요.”"
2748,“이온.. 음료?”
2749,“그러니까 땀을 많이 흘리면 염분을 보충해야 하잖아요.
2750,염분과 그 외에 좋은 성분을 넣는 음료의 일종이에요.”
2751,“...... ”
2752,“왜요? 혹시 제가 이렇게 찾아온 게 불편하세요?”
2753,"“아니, 그럴 리가. 단지... ”"
2754,“단지?”
2755,“좀 놀라워서.”
2756,정말 그랬다.
2757,"아내가 예전과는 완전히 달라졌다는 걸 매번 겪으면서도 나는 여전히 매번 새로웠고, 매번 놀라웠다."
2758,낯선 사내들이 우글거리는 훈련장까지 나를 보기 위해 왔다니.
2759,그것도 수건과 마실 거리를 생겨서.
2760,이건 사실 보통의 귀족부인들도 좀처럼 하지 않는 행동이었다.
2761,"거친 남자들의 세계, 그걸 멀리서 지켜보며 응원의 손수건을 던지는 거라면 몰라도 흙바닥을 밟아가며 땀내 나는 사내들과 가까이 마주하는 건, 귀족부인으로서의 품위에 어긋나는 거라고 여기는 게 당연했으니까."
2762,“그럼 놀라는 건 오늘까지만 하세요.
2763,앞으로는 여기서 볼 일 자주 있을 것 같으니까.”
2764,“여길 또 온다고?”
2765,"“네, 당신이 오늘처럼 훈련에 참석하시면요."
2766,"설마 제게 선물한 꽃다발, 그거 오늘 한 번만 보내고 마실 건 아니죠?”"
2767,“당신이 원한다면 매일 아침 보내주지.”
2768,"“뭐, 마음에도 없는 사양은 안 할게요."
2769,그런데 그 꽃다발 이제 별채 말고 본성의 제 처소로 보내주세요.
2770,"내일이나 모레쯤, 처소를 옮길 생각이거든요.”"
2771,"3층, 내 침소에서 복도를 하나 끼고 돌아나가면 나오는 아내의 침소."
2772,그 공간으로 아내가 돌아온단다.
2773,"언제든 원하면 돌아오라 했지만, 글쎄."
2774,어젯밤과 같은 긴장감이 다시 찾아온다면 나는 그녀를 참아낼 수 있을까?
2775,차라리 별채에 떨어져 있는 게 그녀가 계획하는 데이트를 진행하기에 나을 것 같다고 만류해볼까.
2776,“그건... ”
2777,“그런데 기사들에게 저를 언제쯤 소개시켜 주실 거예요?
2778,아닌 척해도 지금 전부 이쪽을 보고 있는 것 같은데.”
2779,내 말을 막아선 아내의 말에 그녀에게서 시선을 거둬 주위를 둘러보았다.
2780,“......”
2781,차라리 적군을 향한 사생결단의 눈 부라림이 더 낫겠군.
2782,덩치는 산만한 것들이 떼거리로 힐끔대는 꼴이라니.
2783,"“다들 예의를 갖추도록. 이쪽은 내 아내, 로즐린 아스트리드다.”"
2784,* * *
2785,해도 다 넘어가고 어두운데 이게 대체 뭐 하는 짓인지.
2786,“이것도 데이트인건가?”
2787,“그럼요. 함께하는 스포츠 관람!
2788,"당신의 일을 존중하며 함께 공유하는, 아주 의미 있는 데이트라고 할 수 있죠."
2789,왜요? 당신은 별로인가요?”
2790,야간 훈련을 위해 설치해 놓은 가로등 불빛 사이로 단상 아래의 기사들이 토너먼트 형식의 대결을 하고 있었다.
2791,"매달 한 번, 자신이 참여하는 훈련일이면 전체 훈련 뒤에 추가로 진행하는 특별 훈련 중 하나였다."
2792,하지만 오늘은 평소보다 길어진 전체 훈련 탓에 생략하기로 결정했고 별 일이 없었다면 지금쯤 자신은 이곳 외성의 연무장이 아니라 본성 집무실에 있었어야 했다.
2793,"그래, 별 일이 없었다면."
2794,‘그러면 어쩔 수 없이 다음 달 정기 훈련까지 기다려야겠네요.
2795,아까 전체 훈련도 굉장히 멋졌는데 개인의 역량을 겨루는 대결이라니.
2796,얼마나 멋질까요? 아...오늘 못 본다는 게 너무 아쉬워요.’
2797,"기사들과의 상견례 후, 아내가 던진 그 한 마디에 지금 이 꼴이 난 거였다."
2798,테레지아 후작가의 영애를 주모로 맞이해야 한다며 못마땅해 할 때는 언제고.
2799,녀석들은 갑자기 둘도 없는 불꽃 기사단이 되어 대결을 한다고 난리였다.
2800,아무래도 아내는 내 기사들이 단순한 편이라는 사실을 눈치 챈 것 같았다.
2801,“분명히 같이 즐기는 게 데이트라고 했던 것 같은데 이건 아무리 봐도 당신만 즐거운 데이트 같군.”
2802,"“어머, 지금 그거 당신에게 충성을 다하기 위해 저렇게 열과 성을 다하는 기사들이 들으면 어엄~청 나게 섭섭할 발언인 거 아세요?”"
2803,단상 아래에서 쓸데없이 열정적인 녀석들도 못마땅했지만 그걸 보면서 반짝거리는 아내의 눈빛이 훨씬 더 마음에 들지 않았다.
2804,아직은 여름이 아니니까.
2805,기사들의 품위를 생각해서라도 훈련 시 정복을 갖춰 입는 것을 고려해 봐야겠다.
2806,^^^
2807,공지입니다. (기존15화=16화로 변경)
2808,
2809,안녕하세요? 그루잠이입니다.
2810,예정보다 연재 시작일이 한참 늦어진점 사과드립니다.
2811,"역시, 쓴 글은 다시 되돌아보지 말아야 한다는 진리를 이번에 깨우쳤습니다."
2812,내글구려병에 걸려서 심각하게 진도를 나가지 못하는 불상사가 생기더군요.
2813,관작하시고 기다려주셨던 독자님들께 죄송하단 말씀드리면서...
2814,생방으로 연재를 했던지라 기존 15화의 각 분량이 고르지 못한 점이 있었습니다.
2815,그래서 좀 더 다듬고 회차 분량을 균일하게 조정하여 16화가 되었습니다.
2816,당연히 추가 되는 문장들이 있긴합니다만 세세한 표현의 교정이라 내용의 흐름에는 아무 변화가 없습니다.
2817,이 점 참고해주시고 새로운 회차는 10월 1일부터 연재토록 하겠습니다.
2818,(기존 분량을 먼저 다시 오픈한 것은 조금이지만 그래도 전체적인 수정이 있었기 때문입니다.)
2819,"제 글을 읽어주시는 독자님들, 항상 감사합니다."
2820,^^^
2821,말의 힘
2822,
2823,(공지사항을 안보는 분이 계셔서 회차에 공지를 올렸더니 실제 회차보다 1화씩 번호가 밀리네요. 헛갈리시는 분 계실까봐 수정안하고 그냥 올립니다.^^)
2824,사방이 책으로 빼곡히 들어찬 공간.
2825,집무실 중앙의 담갈색 가죽 소파에 기대앉은 칼리안은 탁자 위에 쌓여있는 결재서류를 훑어보느라 여념이 없었다.
2826,"“전하, 밤이 늦었습니다."
2827,오늘은 이만하시지요.”
2828,“후우... 몇 시지?”
2829,“곧 자정이 됩니다.”
2830,탁!
2831,“어째 보고 또 봐도 이놈의 서류는 줄질 않는군.”
2832,조금 전까지 칼리안의 손에 들려져 있었던 서류뭉치가 둔탁한 소리를 내며 탁자 위로 떨어졌다.
2833,짜증 섞인 손길을 거두어 마른세수를 하는 칼리안.
2834,워커홀릭으로 유명한 그답지 않은 행동이었다.
2835,"“전하, 뒷정리는 소신에게 맡기시고 이만 침소 드시지요."
2836,고된 훈련에 이어 업무량까지 늘리시니 혹여 몸이 축나실까 저어됩니다.”
2837,“아니. 마저 끝내는 게 좋겠어.
2838,내일부터는 더 바빠질 테니.”
2839,하지만 답을 하는 칼리안의 시선은 다시 집어 든 서류뭉치가 아닌 다른 곳을 향해 있었다.
2840,그것은 탁자 가장자리에 반쯤 펼쳐져 있는 양피지였다.
2841,"붉은색 벨벳이 덧대어진 양피지는 탑처럼 쌓여있는 서류 묶음들과 달리 무척 화려했는데, 문장이 끝나는 오른쪽 하단에는 붉은 태양을 형상화한 문양이 하나 찍혀있었다."
2842,붉은 태양.
2843,그것은 브란델 제국 황실의 인장이었다.
2844,그리고 이 황실에서 온 서신이 칼리안이 뱉어낸 짜증의 시발점이었다.
2845,“출발일은 언제로 하시겠습니까?”
2846,“빠르면 빠를수록 좋겠지.
2847,수도의 얼간이들이 한데 모일 틈을 주게 되면 퍽 골치가 아프거든.
2848,"더군다나 테레지아 후작, 그 여우 같은 자가 또 무슨 일을 꾸밀지 모르니 서둘러야 해."
2849,하아. 그 치들을 상대할 생각을 하니 벌써부터 두통이 이는군.”
2850,“사흘 뒤면 영지 시찰을 나가셨던 에두와르 백작님께서 복귀하실 테니 그에 맞춰 준비토록 하겠습니다.
2851,서두른다면 아마 닷새 안에는 출발이 가능할 듯합니다.”
2852,“그리하도록 해.”
2853,"칼리안은 여전히 찌푸린 얼굴을 한 채, 손에 든 서류로 다시 시선을 가져갔다."
2854,공작령을 비우고 수도 아크레테에 머무르게 될 기간이 짧지 않았다.
2855,자신의 공백이 문제 되지 않도록 급한 업무들을 미리 당겨서 처리할 생각이었다.
2856,하지만 평소 같지 않게 그는 업무에 집중을 하지 못했다.
2857,"서류 한 장에 머무는 시간이 눈에 띄게 길어질 때쯤, 쌓여있던 서류 묶음을 분리하며 칼리안을 보조하던 알베르가 입을 열었다."
2858,“하온데 전하.
2859,이번 수도 행에 마님께서는 아니 가십니까?”
2860,“...... ”
2861,“빨라도 족히 두어 달은 걸릴 것이옵니다.
2862,이제 막 본성 적응을 시작하시려는 마님을 홀로 두고 전하께서 수도로 가버리시면 혹여 불안해하시진 않을지......
2863,신 염려가 되옵니다.”
2864,불안?
2865,그럴 리가.
2866,"사실 말을 하는 알베르도, 듣고 있는 칼리안도 알고 있었다."
2867,이것이 전혀 쓸데없는 걱정이라는 것을.
2868,"하지만 이 쓸데없는 걱정의 말을 알베르가 꺼낸 순간, 칼리안은 지글지글 끓어대던 짜증이 이상하리만치 빠르게 가라앉고 있음을 깨달았다."
2869,“함께 가자 청해보심이 어떨는지요?”
2870,“그녀는 늘 수도 가길 꺼렸어.”
2871,“예전의 마님은 수도뿐 아니라 침소를 나서시는 것도 꺼리셨습니다.
2872,허나 지금은 그때와 다르시지 않습니까.”
2873,알베르의 말처럼 그의 아내는 예전의 아내가 아니었다.
2874,이젠 아크레테라는 말에 사지를 떨어대거나 괴성을 지르는 행동 따윈 하지 않을 것이다.
2875,“...내일 점심이든 저녁이든.
2876,식사 한 끼 함께 하는 거로 하지.”
2877,"“예, 전하."
2878,마님께서 내일 오전 중에 본성으로 거처를 옮기신다 하셨으니 점심을 청하여 자리 마련토록 하겠습니다.”
2879,칼리안은 고개를 끄덕이곤 다시 서류에 집중했다.
2880,짜증이 사그라든 그의 손길이 더없이 빨랐다.
2881,걱정했던 그의 야근은 아무래도 예상보다 일찍 끝날 것 같았다.
2882,‘서류처리가 순조로운 걸 보니 전하의 내일 오후 스케줄은 꽤 여유가 있을 것 같은데.
2883,마님께서도 아침은 가볍게 드시는 편이니 점심은 코스 요리가 좋겠어.’
2884,현명하고 충직한 데다 성실하기까지 한 집사를 둔 칼리안.
2885,그는 참 인복이 많은 남자였다.
2886,* * *
2887,공작가의 본성 입구.
2888,오늘은 그곳 풍경이 평소와 사뭇 달랐다.
2889,납작한 대리석으로 다져진 길 위에 하인들이 모두 나와 양 갈래로 도열해 있었다.
2890,"그 수가 대략 오백에 가까웠는데, 이들이 모여 있는 이유는 로즐린의 본성 복귀를 맞이하기 위함이었다."
2891,별채에서 본성까지는 마차로 겨우 10분 거리.
2892,"이를 맞이하기 위해 오백여 명이 모인 것은 다소 과한 측면이 없지 않았지만, 사실 이것은 로즐린을 위한 알베르의 세심한 배려였다."
2893,피에 절은 갑옷 대신 걸친 것이 신부를 상징하는 새하얀 드레스와 베일이었을 뿐.
2894,"3년 전, 로즐린은 적군의 추격을 피해 숨어든 패잔병과 다를 바가 없었다."
2895,결혼 전까지 철저하게 숨겨왔던 심각한 우울증이 그녀를 초라하고 은밀하게 공작성에 입성하도록 만들었다.
2896,그렇게 입성한 날부터 최근 사고가 일어나기 전까지 계속된 칩거.
2897,자신의 처소 밖으로 나오는 것을 극렬히 거부했던 로즐린이었기에 몇몇 시녀들을 제외한 나머지 하인들은 그녀의 얼굴을 몰랐다.
2898,"물론 요 며칠, 로즐린의 전에 없던 활발함에 몇몇 정도는 얼굴을 봤겠지만 그건 극히 소수에 불과했다."
2899,그러니까 오늘 이 자리는 알베르가 마련한 공작성 안주인과 하인들 간의 공식적인 첫 상견례라 할 수 있었다.
2900,흙먼지를 일으키며 다가온 마차 한 대가 대열의 끝부분에 멈춰 섰다.
2901,그 앞에 다가선 알베르.
