,0
5441,“칼리안 아스트리드 공작내외분 이하 에두와르 필리프백작 드십니다!”
5442,두 번의 경쾌한 종소리와 함께 연회장 정문을 지키고 서 있던 시종이 남편과 나의 입장을 알렸다.
5443,백작 위 이상의 고위귀족들에 한해 시종이 종을 울리며 입장을 외쳐준다고 했다.
5444,“다들 당신만 쳐다보는군.”
5445,“절 보는 다른 사람들 보지 말고 당신도 나만 봐요.
5446,그게 제가 가장 원하는 거예요. “
5447,내 말에 남편이 시선을 내게 고정시켰다.
5448,이제 이곳에서 나에게 시선을 두지 않는 사람은 단 한 사람도 없었다.
5449,넓은 연회장 중앙으로 길게 뻗어있는 붉은 카펫을 남편의 팔에 기대 천천히 걸었다.
5450,“저분이 그 테레지아의?”
5451,"“뭐야, 소문이랑 완전 딴판이잖아!”"
5452,“어머어머 어쩜.
5453,특이한 드레스며 저 화장술은... 대체 뭐죠?“
5454,"감탄의 목소리가 대부분이었지만 말을 아낀 채, 썩은 표정을 짓고 있는 몇몇의 사람들도 보였다."
5455,아마도 귀족파의 세력들이겠지. 아니면 황후의 측근들인가?
5456,뭐가 됐든 여기선 우리 편 아니면 다 적이다.
5457,그리고 분수를 모르는 적에게 자비란 없어야 하고.
5458,"그러니까 다들 어금니 꽉 깨물어라, 엉?"
5459,걸리기만 해봐.
5460,내 아주 묵사발을 만들어줄라니까!
5461,* *
5462,아. 에. 이. 오. 우~~아! 아! 아!
5463,만들어진 미소를 띠고 여러 사람에게 인사를 하느라 조동아리에 경련이 오기 직전이었는데 부채 뒤에 숨어서 스트레칭을 하고 나니 한 결 편안해졌다.
5464,디자인이 영 내 스타일이 아니라서 두고 오려고 했는데.
5465,레아가 억지로 챙겨준 레이스 부채는 생각보다 요긴했다.
5466,“휴우.”
5467,"“마님, 많이 지치신 것 같습니다."
5468,여기 차가운 냉수입니다. “
5469,"“아, 고마워요 라티 경.”"
5470,금발의 기사가 건네주는 유리잔을 들어 목을 축였다.
5471,빈 잔을 공손히 받아드는 기사 베아스 라티.
5472,중요한 업무를 맡게 된 예르딘 대신 어제부터 내 호위기사가 된 남자였다.
5473,"테라스 정원으로 이어지는 창가 쪽 소파에 앉아있는 나를 아까부터 열심히 호위 중이었는데, 덕분에 웬만한 쩌리들은 내 주변으로 얼씬도 하지 않았다."
5474,‘쓸데없는 자들의 접근은 사전에 차단하도록.’
5475,조금 전에 남편이 라티 경에게 남기고 간 명령이었다.
5476,그럴 만한 것이 남편이 옆에 있는 데도 어찌나 내게 달라붙는 사람이 많던지.
5477,"대부분 황제파에 속한 중소귀족들이었는데 강철같이 단단하고 뻣뻣한 남편을 공략하는 것보다 소녀소녀한 내 쪽을 공략하는 게 낫겠다고 판단한 건지, 내가 듣던 말든 제 이름과 소속, 장점 등등을 마구 어필해댔다."
5478,... 악몽의 그 케토톱 백작이 재림한 줄 알고 식겁했다.
5479,"어쨌든 남편은 황제파 주요 귀족들에게 나를 인사시킨 후, 공작으로서의 의무를 다하기 위해 또 다른 귀족 무더기로 걸어 들어간 상태였다."
5480,쩌어기... 멀리 남편의 뒤통수가 보일랑 말랑했다.
5481,"에휴, 얼마나 피곤할까."
5482,나는 아까 잠깐 겪었을 뿐인데도 진짜 죽는 줄 알았는데.
5483,대체 귀족들은 이딴 재미도 없는 파티를 왜 참석하지 못해 안달인 걸까.
5484,"온통 아부에 가식, 마음에도 없는 말투성이 인 것도 참기 힘든데, 향수를 아예 각자 한 통씩 들어붓고 오신 건지."
5485,독한 향수 여러 개가 섞이다보니 내 다리로 땅을 딛고 서 있는 데도 멀미가 날 지경이었다.
5486,물론 예외는 있었다.
5487,"정제된 말투, 고급스럽고 정갈한 옷차림."
5488,제일 처음 인사를 했던 노귀족 두 분은 무척 점잖고 기품 있으신 분들이었다.
5489,"그냥 딱 봐도 나 귀족이요, 아주 높은 귀족이요 하는 티가 팍팍 났달까?"
5490,‘드디어 부인을 뵙게 되는군요.
5491,이리 아름다우신 분을 뵙게 되어 영광입니다.
5492,에드먼 단테스라 합니다.
5493,과분하게도 황궁 기사단의 단장을 맡고 있지요. ‘
5494,‘테레지아의 핏줄로는 전혀 보이지 않는 구료.
5495,"아, 물론 이건 칭찬이라오."
5496,"루이스 아델하이트, 전 황후마마의 아비 되는 사람이오.‘"
5497,에드먼 단테스 후작과 루이스 아델하이트 대공.
5498,두 사람은 남편과 함께 황제파의 중심이라고 했다.
5499,비록 두 사람 중 아델하이트 대공의 태도가 좀 까칠하긴 했지만... 뭐 참을 만 했다.
5500,오히려 그의 심정을 이해하는 측면도 있었다.
5501,자신의 딸이 죽고 비어있던 황후 자리를 꿰찬 샤를로트의 동생이자 웬수같은 테레지아 후작의 둘째 딸이 바로 나 아닌가.
5502,어찌 보면 그 정도로 까칠하고 만 게 다행스러운 일이었다.
5503,그나저나 로열패밀리는 대체 언제쯤 오시나.
5504,황제 뿐 만이 아니라 내가 한바탕 결전을 각오했던 테레지아 후작의 모습도 보이지 않았다.
5505,지금이 벌써 다섯 시 반.
5506,보통 황제는 파티가 무르익을 즈음인 다섯 시 반에서 여섯 시 사이에 등장한다고 했는데.
5507,최종보스 등장하고 테레지아까지 오면 본격적으로 아껴뒀던 힘을 발산해야 했다.
5508,그때부터가 귀족파 나부랭이들이 내게 본격적으로 달려들 시점이 될 테니까.
5509,곧 다가올 썰전을 대비하기 위해 마음을 다지고 있는데 뒤에 서서 사방을 야려보던 라티 경이 내게 말을 걸었다.
5510,"“마님, 헌데 아직까지 테레지아 후작은 보이지 않습니다.”"
5511,“그러게요. 뭐 올 때 되면 오겠죠.”
5512,"“마님께는 아버지가 되시는데, 별로 궁금하지 않으신가봅니다.”"
5513,얘... 뭐지?
5514,이거 지금 나 멕이는 건가?
5515,왜? 나 너님 고용주 와이픈데?
5516,“저보다는 라티경이 더 궁금해 하는 것 같은데.”
5517,“그냥 편하게 베아스라고 부르시라니까요.
5518,"아니면 혹여 예르딘에 비해 제가 불편하시다거나, 못마땅한 부분이라도 있으신 겁니까? “"
5519,"응, 불편해."
5520,방금 전 네 질문도 못마땅하고.
5521,“뭐... 썩 편하진 않네요.
5522,제가 그리 까다로운 편은 아닌데.
5523,거 참 이상하죠? “
5524,싱긋
5525,어쭈? 웃어?
5526,“원래 제가 처음엔 좀 어색한데 보면 볼수록 정감이 가는 그런 매력이 있습니다.
5527,"허니 조금만 더 지켜 봐 주십시오, 마님. “"
5528,"그래서 지금 시비 거는 거야, 잘 지내자는 거야?"
5529,내가 두루두루 다양한 또라이들을 상대해봤지만 그 중에서 유독 상성이 안 맞는 게 이런 애들이다.
5530,실실 웃으면서 의뭉스럽게 말하고 행동하는 거.
5531,내편인 듯 내편 아닌 적군 같은 놈이랄까?
5532,"“네, 쭉 지켜볼 테니 앞으로는 노력 많이 하세요, 라티 경.”"
5533,그래 나도 이제 좀 궁금해졌다.
5534,너란 놈이.
5535,* *
5536,“괜찮을는지 모르겠습니다.”
5537,“걱정 마.
5538,물리력 빼면 내 아내가 더 세니까 . “
5539,뒤 편 테라스 소파 쪽을 연신 돌아보는 에두와르에게 칼리안이 덤덤하게 말했다.
5540,대체 마님의 성정이 어떠하시기에 주군께서는 저리 천하태평이신지.
5541,"밝아지시고 웃음이 많아지셨다는 등, 긍정적으로 바뀌셨다는 건 들어 알고 있었지만 그것과 이것은 다른 것인데."
5542,에두와르는 답답할 따름이었다.
5543,“... 아무래도 마님을 가까이서 뵐 기회를 한 번 마련해봐야겠습니다.
5544,제가 아는 마님과 전하께서 말씀하시는 마님의 간극을 좁히기엔 제게 정보가 너무 모자란 것 같습니다. “
5545,"“어허, 공작께서 하시는 말씀을 수하된 자가 의심하니 이거야말로 불충 아닙니까?”"
5546,"“아, 단테스 후작 각하!”"
5547,과장된 표정으로 익살스럽게 말하는 노인을 보며 에드와르가 허리를 숙였다.
5548,“그러게 말입니다.
5549,벌써 여러 번 말했는데 제 말은 콧등으로 듣는 건지.
5550,스승님께서 한 마디 해 주십시오. “
5551,“스승님은 무슨.
5552,어릴 적 일 이년 훈수 좀 드린 걸 가지고 공작께서 이 늙은이에게 과한 감투를 씌워주십니다. 허허. “
5553,스승이라는 말에 손사래를 치는 에드먼 단테스 후작은 황궁 제1 기사단인 피닉스 기사단의 단장이자 황제의 검술 스승이기도 했다.
5554,“뭐 그런 의미도 있지만 실은 폐하와 사형제지간 먹으려는 계산이 더 큽니다. “
5555,"“어이쿠, 그렇게 된다면 오히려 공작께서 손해십니다."
5556,폐하께서 사제가 된 공작전하을 그냥 내버려 두시겠습니까?
5557,아마 부려먹지 못해 안달이실 겁니다. “
5558,"“뭐, 대신 이 사제의 간절한 소원 한번쯤은 들어주시지 않겠습니까?”"
5559,"소원, 그 추상적인 말에 둘 사이에 일순간 침묵이 흘렀다."
5560,"말을 한 칼리안도, 들은 단테스 후작도 그 소원이 아마도 테레지아에 관한 것이 될 것이라, 짐작했기 때문이었다."
5561,“... ‘그 소원’은 쓰는 일이 없는 게 모두에게 좋습니다.
5562,아시지요? “
5563,하지만 칼리안은 단테스 후작의 말에 답을 하지 않았다.
5564,대신 질문을 했다.
5565,"“제 아내를, 로즐린을 보신 소감이 어떠십니까?”"
5566,"“폐하께 전해들은 바가 있긴 했습니다만, 상상 이상이었습니다."
5567,무척 기품 있고 아름다우신 귀부인이시더군요.
5568,여러 모로 남달라 보이시기도 했지요. “
5569,"“예, 그래서입니다."
5570,제가 그 소원을 쓸지도 모른다는 게. “
5571,“...... ”
5572,로즐린을 위해 테레지아에 관한 소원을 쓸지도 모른다는 칼리안.
5573,그를 바라보는 단테스 백작의 눈에 근심이 드리웠다.
5574,"그리고 그때, 두 번의 종소리와 함께 시종의 우렁찬 목소리가 들려왔다."
5575,“앙리 테레지아 후작 각하 드십니다!”
5576,
5577,
5578,
5579,[작품후기]
5580,간만에 불태웠구먼유...
5581,^^^
5582,내 사람을 지키는 방법
5583,
5584,"한 올의 흐트러짐도 용납지 않겠다는 듯, 정갈하게 빗어 넘긴 푸른 머리."
5585,회백색 바탕에 금색으로 수놓아진 슈트.
5586,담백함 속에서 느껴지는 화려함이 뭔가 이중적이면서 묘하게 위압적인.
5587,175cm정도의 그리 크지 않은 키에 호리호리한 체구임에도 불구하고 사람들이 남자에게서 눈을 뗄 수 없는 이유였다.
5588,저벅 저벅 저벅
5589,붉은 카펫위로 걸음을 옮기는 그 흐름을 따라 사람들이 시선이 움직이고 있었다.
5590,"남자는 그것이 당연하다는 듯, 자신에게 달라붙는 시선들을 흘려내며 덤덤한 표정으로 연회장의 중심으로 들어섰다."
5591,어느덧 카펫 끝자락에 멈춰선 남자에게 일련의 무리들이 다가와 허리를 깊게 숙였다.
5592,“테레지아 후작 각하를 뵈옵니다.”
5593,“후작 각하를 뵈옵니다.”
5594,"앙리 테레지아, 그는 자신을 맞이하는 귀족들을 향해 난감하다는 듯 멋쩍은 미소를 띠며 말했다."
5595,"“허허, 사람들 참."
5596,내 이리 부산스럽게 맞이할 필요 없다 누누이 말했건만.
5597,자네들도 알다시피 여기 내 위에 사람이 몇인가.
5598,이리 소란을 떨면 나는 물론이거니와 황후마마께도 누가 될 수 있음이야.”
5599,"“각하, 그런 말씀 마십시오."
5600,제국의 하늘아래 어느 누가 후작각하께 존경의 예를 올리지 않을 수 있겠습니까?”
5601,“제리 자작의 말이 맞습니다.
5602,후작각하의 위라 해보았자 딱 두 분이신데...
5603,아무리 작위의 서열이 중요하다해도 통일전쟁의 일등공신이신 각하께 올리는 이 정도의 예를 과례라 질타한다면 만백성의 비웃음을 살 것이옵니다.”
5604,"무리의 선두에 위치한 갈색 머리의 중년인, 자타공인 테레지아 후작의 오른팔로 불리는 페레레 로쉬 백작의 말에 좌중이 고개를 끄덕였다."
5605,"“허허, 사람들 참."
5606,적당히 하란 소리에 뭘 그리 또 정색을 하누.”
5607,못 말리겠다는 듯 허허 웃으며 허리 숙인 귀족들에게 이만 예를 거두라 손사래를 치는 테레지아 후작이었다.
5608,"그때, 후작의 곁으로 왜소한 체구의 인영 하나가 다가섰다."
5609,“그러게나 말일세.
5610,‘적당히’란 말이 무사무탈의 비책이라는 것을 여기 계신 후작께서 몸소 실천하고 계신데 다들 어찌 그걸 모르는지.
5611,"아니 그런가, 테레지아 후작?”"
5612,아델하이트 대공의 가시 돋친 말에 테레지아 후작이 웃는 낯으로 고개를 숙였다.
5613,"“송구합니다, 대공전하."
5614,이들 중 대부분이 수도 진출한지 얼마 되지 않은 정치신인들이옵니다.
5615,하여 가슴이 시키는 대로 행동하는 것이 때로는 독이 될 수 있음을 아직 깨닫지 못하였지요.
5616,"경솔타 질타마시고, 정치선배로서 너그러운 조언을 해 주심이 어떨는지요."
5617,어찌됐든 이들 모두가 장차 제국을 이끌어갈 원동력 아니겠습니까?”
5618,"비굴하지도, 예의에 어긋나지도 않을 적당한 기울기로 허리를 숙인 테레지아 후작."
5619,그의 유려한 말솜씨에 아델하이트 대공의 입매가 일그러졌다.
5620,“이거 소인이 괜한 말을 해 후작각하께 누를 끼친 것 같습니다.
5621,송구하옵니다.
5622,"대공전하, 이만 마음을 푸시지요.”"
5623,그에 더해 로쉬 백작까지 아델하이트 대공에게 사죄의 말을 올리자 좌중의 시선이 대공에게 쏠렸다.
5624,“... 허!”
5625,"이제 사죄를 받아들이든, 받아들이지 않던, 아델하이트 대공의 꼴은 우습게 되는 상황이었다."
5626,"그 때, 근처에서 이를 지켜보던 칼리안과 단테스 후작이 아델하이트 대공 곁에 다가섰다."
5627,"“공작전하, 오랜만에 뵙습니다."
5628,"에드먼, 자네도 함께 있었군.”"
5629,"“앙리, 자넨 오늘따라 좀 늦었군."
5630,혹여 폐하보다 늦게 오는 건 아닌가 걱정했다네.”
5631,“그럴 리가.”
5632,"테레지아 후작의 인사, 그리고 단테스 후작의 화답."
5633,하지만 칼리안은 테레지아 후작에게 시선을 두지 않았다.
5634,그의 시선은 후작의 곁에 선 페레레 로쉬 백작을 향하고 있었다.
5635,“사죄의 대상이 한참 잘못됐군.”
5636,“예? 그게 무슨 말씀이신지... ”
5637,“이봐 로쉬 백작. 내 말 잘 들어.
5638,자네가 진정 누를 끼친 건 여기 테레지아 후작이 아니야.
5639,이 제국의 주인이신 황제폐하지.”
5640,고저 없이 싸늘한 목소리.
5641,칼리안의 말에 일순간 사방이 조용해졌다.
5642,그 일시적인 침묵 속에서 귀족파 무리들을 훑어 내린 칼리안이 말을 이었다.
5643,“고작 후작의 작위 앞에 이리 허리를 숙여놓고 폐하께서 납시시면 대체 어찌할 생각들이지?
5644,자네들 모두 바닥에 이마를 붙여 납작 엎드리기라도 할 건가?”
5645,“!”
5646,“이런 덜떨어진 감으로 살벌한 중앙정치에서 어찌 수년 째 버텼는지...
5647,나로서는 참 의문이군”
5648,"바짝 얼어붙은 귀족무리에서 로쉬 백작, 그리고 테레지아 후작에게까지."
5649,천천히 시선을 돌리는 칼리안.
5650,그 싸늘함에도 테레지아 후작은 예의 그 미소를 지우지 않고 담담히 응대를 했다.
5651,“로쉬 백작과 이들의 처신을 너무 나무라지 마십시오.
5652,"정치적인 계산에 앞서 매사 진심으로 사람을 대한다는 것, 그것이야말로 충신의 기본 자질 아니겠습니까?”"
5653,“헌데 그 진심의 방향이 크게 엇나가고 있는 것 같아서.”
5654,단테스 후작에게 대했던 것과 달리 테레지아 후작에게는 하대를 서슴지 않는 칼리안과 전혀 웃을 상황이 아님에도 불구하고 만면에 띤 미소를 지울 생각이 없는 테레지아 후작.
5655,이 둘 사이에 튀는 불꽃을 흥미진진하게 바라보던 아델하이트 대공이 다시 참전할 기색을 보였다.
5656,하지만 더 이상 황제파와 귀족파의 구도로 설전이 확대되는 건 좋지 않았다.
5657,상황을 지켜보던 단테스 후작이 중재에 나섰다.
5658,"“자, 자. 이제 곧 폐하께서 납시실 시간입니다."
5659,경사스러운 날에 이리 분위기가 어수선해서야 이거야말로 불충 아니겠습니까?
5660,보십시오. 다들 이쪽만 쳐다보고 있느라 연회장 분위기가 아주 엉망입니다.
5661,허니 이만들 하시지요.
5662,"그리고 앙리, 자네는 꼭 만나 봐야 할 사람이 있을 텐데."
5663,무려 3년 만에 보는 딸을 지척에 두고 여기서 이럴 여유가 있는가?”
5664,아무리 버린 딸이라지만.
5665,그 말이 생략되어 있음을 테레지아 후작이 모를 리 없었다.
5666,하지만 답을 하는 후작의 어조는 담담하기 이를 데 없었다.
5667,“쓸데없이 호들갑을 떨 이유는 또 뭔가.
5668,"언제, 어디서, 얼마 만에 보건 간에 로즐린이 내 딸이고 내가 그 아이의 아비인 것은 변함이 없는데.”"
5669,"오른쪽, 테라스 소파에서 여전히 휴식 중인 로즐린 쪽으로 시선을 던진 테레지아 후작이 다시 칼리안을 향해 미소 지었다."
5670,“ 본디 피를 나눈 사이란 그런 것이지.
5671,그런 게 가족이고 핏줄 아닌가. 허허”
5672,핏줄.
5673,그 부정할 수 없는 말에 칼리안은 더 이상 대꾸하지 않았다.
5674,* *
5675,“테레지아 후작입니다.”
5676,알아.
5677,나도 보고 있거든.
5678,연회장 중앙에서 이곳 외곽 테라스가 그리 멀지 않아 꽤 선명하게 후작의 얼굴을 볼 수 있었다.
5679,"60대의 나이라고 믿기지 않을 만큼 동안이었고, 매끈한 미남이었다."
5680,가문의 후계가 따로 없는 외동딸들만 꼬셔서 두 번이나 결혼에 성공했다기에 대체 어떻게 생겼을까 궁금했는데.
5681,젊었을 때 여자 꽤나 울렸을만한 외모였다.
5682,나는 푸른 머리색과 동안외모만 친탁을 했고 이목구비는 외탁을 한 모양이었다.
5683,"쳇, 이왕 줄 거면 다 줄 것이지."
5684,“가보지 않으실 겁니까?”
5685,아... 진짜 얘는 뭔 캐릭터야?
5686,무슨 호위기사가 지킬 생각은 않고 자꾸 어딜 가재.
5687,“아직 다리가 아파서요.
5688,그리고 후작도 공사가 다망하신 것 같고.
5689,뭐 급할 거 있나요?
5690,돌아가기 전에 한 번은 만나겠죠.”
5691,아무리 비싼 수제화라 해도 첫날은 길이 들지 않아 발이 아프기 마련이었다.
5692,내가 야심차게 직접 디자인 한 아이보리 색 펌프스 또한 마찬가지였고.
5693,"소파에 앉아 진주로 장식된 구두에서 살짝 부은 발을 뺀 채, 부채를 팔랑였다."
5694,그런 나를 보는 라티 경의 표정이 웃겼다.
5695,"이 마님이란 여자, 대체 뭐지?"
5696,이런 생각을 억지로 감추려다 실패한 표정이랄까. 후후.
5697,내가 아버지를 후작이라 칭하며 시큰둥해 하는 것에 꽤 놀란 것 같았다.
5698,서로를 보며 같은 생각을 했지만 승리는 내차지였다.
5699,“그나저나 생각보다 저쪽 분위기가 과열되는 것 같네요.
5700,테레지아 후작을 따르는 이들이 언뜻 더 많기도 하고.”
5701,“그래봤자 쪽수만 많은 겁니다.
5702,다들 저자의 낯짝과 언변에 속아 불나방처럼 달려드는 신진귀족들이지요.”
5703,저자.
5704,"내 반응을 좀 더 떠보려는 건지, 아니면 말하다 보니 제 성질에 받친 건지 테레지아 후작에 대한 라티 경의 어조가 점점 거칠어졌다."
5705,그런데 신진귀족들이라.
5706,그 젊고 야망 넘치는 귀족들이 제국의 젊은 영웅인 칼리안이 아니라 왜 늙다리 후작에 불과한 앙리 테레지아에게 붙은 거지?
5707,그것도 황제와 척을 지고 있는 걸 알면서.
5708,내 의문 섞인 시선에 라티 경이 말을 이었다.
5709,“왕국이었던 우리 브란델이 통일전쟁으로 제국이 된 건 아시지요?”
5710,끄덕끄덕
5711,“그 수혜를 톡톡히 얻다 못해 손바닥 만 한 공훈을 엄청나게 부풀려먹은 작자가 바로 테레지아 후작입니다.
5712,당시 황자이셨던 지금의 폐하를 목숨으로 지키신 선대 공작전하의 공에 비하면 정말 티끌만한 공훈일 뿐인데 말입니다.”
5713,극히 일부이긴 했지만 케토톱 백작이 쏟아냈던 말들 중에 몇 가지는 기억이 났다.
5714,"27년 전, 전쟁에서 지금의 황제를 구하고 목숨을 잃은 후안 아스트리드 백작."
5715,적국이었던 레노아의 성을 최종 함락시킨 에드먼 단테스 백작.
5716,그리고 얼추 괜찮은 외교력으로 레노아 왕국의 항복을 이끌어내 전쟁을 종식시킨 앙리 테레지아 자작.
5717,"그 셋 중에 최고의 공훈을 세운 아스트리드 백작가가 공작의 작위를 받았고 단테스 백작이 후작의 작위를, 테레지아 자작이 백작의 작위를 받았는데 얌생이 같은 테레지아 백작이 어린 황제에 맞서는 귀족파의 수장을 자처하며 20여 년간 세력을 키웠고, 결국 후작의 자리까지 올랐다는."
5718,이 이야기를 할 때 어찌나 케토톱 백작이 침을 튀겨가며 열변을 토하던지 놓쳤던 정신줄을 나도 모르게 부여잡았더랬지.
5719,그때 이야기를 들으면서 테레지아 후작의 수완에 나도 모르게 감탄했었다.
5720,선대 황제가 전쟁 중에 입은 상처로 일찍 죽고 15살의 어린 황제가 즉위한 틈을 타서 세력을 불려나간 그 과정들.
5721,"돈, 정보, 인맥, 그리고 결혼장사."
5722,보통의 사람이라면 결코 해낼 수 없는 일들이었다.
5723,하긴 그랬으니 지방 어디 촌구석 준남작 가문의 차남으로 태어나 자력으로 후작자리까지 올랐을 테지.
5724,라티 경의 계속되는 성토를 귓전으로 흘리며 중앙 쪽에 시선을 두고 있었는데 칼리안과 대치중이던 테레지아 후작이 갑자기 내 쪽을 쳐다봤다.
5725,그리고 다시 칼리안을 바라보며 뭐라 뭐라 말하더니 활짝 웃는 게 아닌가.
5726,"아, 꼴 뵈기 싫어."
5727,"나를 보고 웃었든, 칼리안을 보고 웃었든 이미 내 기분은 더러워진 상태였다."
5728,외교력으로 공훈을 쌓고 명연설로 뭇 귀족들의 마음을 사로잡았다지?
5729,하지만 나도 댁 못지않게 산전수전 공중전까지 다 겪고 지옥에서 살아 돌아온 여자라 이거야.
5730,"“마님, 테레지아 후작이 이쪽으로 오고 있습니다.”"
5731,“그러네요.
5732,"라티 경, 나 좀 일으켜 줄래요?”"
5733,그렇지.
5734,아쉬운 놈이 먼저 찾아오기 마련이지.
5735,붓기가 가라앉은 발을 구두에 다시 끼워 넣었다.
5736,그렇게 바닥을 디딘 후 들어 올린 시야에 남자 둘이 들어왔다.
5737,부드러운 미소를 띤 테레지아 후작과 갈색 머리를 한 그의 꼬붕 하나.
5738,“안녕하셨어요?”
5739,입 꼬리를 최대한 끌어올려 세상에 다시없을 미소를 지어보였다.
5740,후작의 얼굴에 발린 미소가 흔들릴 정도로 환한 미소를.
5741,"내가 아는 승리 불변의 법칙, 그것은 선빵이었다."
5742,^^^
5743,내 사람을 지키는 방법
5744,
5745,“안녕하셨어요? 테레지아 후작님.”
5746,칼같이 선을 긋는 내 인사에 주변이 작게 웅성거렸다.
5747,로티 경의 철저한 물 관리로 내 반경 5미터까지는 인적이 없는 상태였지만 유명인사의 복잡한 가정사 만큼 흥미로운 게 어디 있다고.
5748,다들 안보는 척 하면서 귀를 이쪽으로 쫑긋거리고 있었다.
5749,“좋아 보이는구나.”
5750,"애틋한 막내딸을 보는 듯, 자상범벅의 미소."
5751,이 몸의 아버지란 작자는 그렇게 내 선빵에 맞불을 놓았다.
5752,“후작께서도 저 못지않으신 걸요.”
5753,“사고로 기억을 잃었다기에 걱정이 많았다.
5754,그 이후 바깥출입을 시작했다기에 불행 중 다행이라고도 여겼고.
5755,헌데 3년 만에 만난 아비에게 너는 후작이라 부르는구나.”
5756,씁쓸하지만 이해한다는 표정.
5757,옅어진 미소와 부드러운 시선 콤보로 후작은 내게 연타를 날렸다.
5758,어쭈!
5759,불효녀 공격이라 이거지?
5760,“각하께서 3년 동안 연락 한 번 없으셨다 서운해 하실 수도 있습니다.
5761,"허나 폐하의 명으로 아스트리드 가에 영애를 시집보내신 뒤, 각하께서는 불면의 밤을 자주 보내셨습니다."
