,0
0,어이가 없네
1,
2,서너 평 남짓의 반 지하 원룸.
3,"소형 냉장고와 커튼으로 덮인 헹거, 그리고 화장대와 식탁을 겸하는 1인용 좌식책상이 자리한 단출한 공간이었다."
4,"‘후두둑, 후두둑, 투둑, 투둑’"
5,골목길에 걸쳐진 창틀로 제법 굵은 빗방울이 부딪히고 있었다.
6,방안을 떠돌던 희미하던 곰팡내는 여름장마의 습기를 머금고 점점 짙어지다 회전하는 선풍기 앞에서 흩어지길 반복했다.
7,“기분도 꿀꿀한데 비까지 오고 아주 그냥 우울이 쌍쌍바네.
8,"하아...주님, 정말 주님이 아니었다면 제가 무슨 재미로 살았을까요?”"
9,[...... ]
10,“내 영혼의 닭고기 수프 맥주님~~~
11,크으...조오타!! ”
12,[...... ]
13,"체리 색 칠이 군데군데 벗겨진 개다리소반 위로 한 쪽 팔을 괴어 기댄 채, 반 쯤 비워진 맥주 캔을 향해 열렬히 고백중인 이 여자."
14,박서연은 초저녁부터 시작한 혼술에 얼큰하게 취해 있었다.
15,선풍기 바람에 파르르 떨어대는 검정 비닐봉지 속에는 구겨진 빈 맥주 캔이 그득했고 그녀의 고백을 묵묵히 받아주고 있는 맥주 캔이 마지막 남은 것이었다.
16,자신의 주량을 초과한 게 이미 한참 전이지만 서연은 성에 차지 않는지 남은 맥주를 들이키느라 꿀렁이는 목울대를 멈추지 않았다.
17,하긴 어찌 취하지 않고 배길까.
18,오늘처럼 거지같은 날에.
19,* * *
20,"“서연 씨, 이거 내 청첩장.”"
21,"헐, 대박. 너 같은 또라이도 결혼이란 걸 하긴 하는구나."
22,"“어머 오 과장님, 완전 축하드려요~ 청첩장도 너무 예쁘고. 역시 과장님 센스!”"
23,“날짜가 좀 급하긴 한데 이 날이 길일이라고 그이 집에서 어찌나 서두르는지...호호. 내 결혼식 올 거지?”
24,... 너의 그이에게 애도를 표한다. 진심이다.
25,"“그럼요 오 과장님, 당연히 가야죠."
26,그런데 날짜는 어... 이번 주 토요일...이네요? 아 하하하... ”
27,“왜에? 자기 혹시 다른 스케줄 있어? 설마... 못 오는 거야?”
28,무슨 소리냐. 천지가 무너져도 가야지.
29,"암, 네 발로 기어서라도 가야 하고말고."
30,니 결혼식에 감히 나 따위가 불참하고 살아남을 수나 있겠냐?
31,아니 그런데... 하는 건 좋다 이거야.
32,"그런데 허고 많은 날 중에 왜 하필 이번주인거니, 응?"
33,월급 날 지나고 하면 좀 좋아?
34,“어머~ 무슨 말씀이세요.
35,오 과장님 결혼식에 제가 빠질 수야 있나요.
36,있던 스케줄도 취소하고 가야죠.”
37,“그치? 정말 다행이다.
38,나도 자기 없으면 무지하게 섭섭할 것 같거든.
39,여기 음식이 비싼 값을 하는지 맛이 꽤 괜찮더라고.
40,편하게 밥 한 끼 한다 생각하고 오면 돼.
41,"아 참, 사진은 꼭 찍고 밥 먹는 거, 알지?”"
42,자기는 너한테 낚인 그 불쌍한 작자가 자기고. 난 자기 아니고 완전 남이거든!!!
43,평소에는 그렇게 쥐 잡듯이 잡아대더니.
44,이제 와서 결혼식 기념사진 배경이 아쉽냐?
45,에라이... XXX!!
46,“아이 그럼요.
47,"그 정도 에티켓은 하객의 기본이죠, 호호호... ”"
48,억지 웃음을 짜내며 비루한 통장 잔고를 떠올리자니 속이 아주 썩어 문드러졌다.
49,"비싼 밥 운운하는 거 보니 5만원, 7만원은 꿈도 꾸지 말라는 건데..."
50,축의금은 최소 10만원.
51,젠장! 이번 달도 마이너스다.
52,* * *
53,낮에 있었던 일을 생각하니 술기운이 뻗쳐올랐다.
54,“아 놔 진짜...
55,"얼굴도 성격도 쌍으로 개차반인 오 과장도 결혼이란 걸 한다는데, 응?"
56,"서연이야, 박서연이야 너는 대체 여태껏 뭐하고 살았니이~~엉?”"
57,허공을 향해 대거리를 하며 손을 휘둘러대자 시야가 핑 돌았다.
58,곧 죽어나갈 개다리소반이 내 팔꿈치 무게를 견디느라 애달프게 부들거렸지만 이거라도 지탱하지 않으면 고꾸라질 것 같았다.
59,내가 많이 마시긴 했나보네.
60,원래 평일에는 다음날 출근 걱정에 절대 과음하지 않는 게 내 철칙이었는데.
61,"하, 철칙 따위 이제 개나 물어가라지."
62,지킬 거 다 지켜가면서 열심히 일 해봤자 회사는 절대 나를 지켜주지 않는다.
63,"하긴, 피로 맺어진 부모도 나를 버렸는데 고작 근로계약서 한 장으로 맺어진 회사가 뭐라고 나를 지켜준단 말인가."
64,금수저? 은수저?
65,"아주 옛날, 뭣 모르던 어릴 때는 그런 꿈을 꾼 적도 있었다."
66,잘 차려입은 후원자들이 고급 승용차를 몰고 고아원을 방문할 때마다 혹여나 돌아가는 차 뒷좌석에 나를 태워가지는 않을까 하는.
67,그런데 그런 행운은 내게 없었다.
68,왜냐고?
69,레벨이 안돼서.
70,우습지만 고아원생들 안에서도 갑과 을은 존재했다.
71,나는 아쉽게도 을의 위치였다.
72,"외모든, 재능이든 뭐 하나 특별하지 않아서 을이었다."
73,그렇게 수저 없이 맨 손으로 흙 파먹고 살아온 짠 내 나는 32년 인생.
74,"그저 남들처럼 취직하고, 결혼하고, 아이를 낳고..."
75,그렇게 살고 싶었다.
76,"온전한 내편, 사랑하는 가족과 함께 살아가고 그 곁에서 늙어가는 것."
77,하지만 이 평범한 꿈도 나에게는 사치였다.
78,졸업하자마자 대출 갚기에 급급해서 전공인 디자인과는 전혀 상관없는 백화점 판매원으로 취직을 했다.
79,6년 만에 겨우 겨우 학자금 대출 전액 상환을 하고 보니 내 나이 서른.
80,"손에 쥔 건 보증금 오백에 육십 짜리 월세 방, 그리고 세계 백화점 대리라고 찍힌 명함이 전부였다."
81,그 나이에 대리 직함이면 순탄한 거 아니냐고?
82,계속 버텨냈다면 그랬겠지.
83,하지만 진상 손님 슈퍼 갑 질은 참아도 기름진 직장 상사놈의 성희롱은 참을 수가 없었다.
84,대차게 들이 받았더니 바로 다음날 백화점 명품관에서 상설 할인매장으로 좌천 되었다.
85,회사의 품위를 손상 시켰다는 것이 이유였다.
86,다 개소리였다.
87,내 엉덩이를 주무른 상사놈은 그 해에 승진을 했다.
88,그때 생긴 울화가 쌓이고 쌓여 얻게 된 소화불량에 역류성 식도염.
89,나는 그들과 절친이 되어 2년째 동고동락 중이다.
90,좀 괜찮다 싶다가도 금세 재발하는 지랄 같은 병이라 어떨 땐 한 달 치 편의점 맥주 값보다도 약국에서 쓰는 돈이 더 많았다.
91,목구멍이 포도청이라 근근이 참고는 있지만 이렇게 10년을 더 버틴다 한들 쥐꼬리 만 한 월급으로 어느 세월에 목돈 한번 만져볼까?
92,전세가는 억 소리 나는데 내 월급은 악 소리 밖에 안 나오는 게 아픈 현실이다.
93,"그래, 쥐뿔도 없는 주제에 결혼은 무슨."
94,... 술이나 마시자.
95,“아이쒸. 뭐야 엄써어?
96,따~악 한 캔만 더 하고 시픈데...”
97,평소 같았으면 귀찮아서 그냥 씻고 잤을 텐데.
98,"웬걸, 간만에 불붙은 알코올 파워가 귀차니즘을 이겨버렸다."
99,검은색 장대 우산을 들고 삼선 슬리퍼를 질질 끌며 원룸을 나서자 후텁지근한 바람이 불쾌했다.
100,절로 걸음이 빨라졌다.
101,“아흐... 왜 이르케 어두워어.”
102,고장 난 가로등 때문인지 취기에 흔들리는 시야 때문인지.
103,도로 공사 한답시고 좁은 골목 가에 켜켜이 쌓아놓은 철근과 공사 자재들이 연신 발에 채였다.
104,“이눔의 공무원 시키들은 내 도온 거더가서 어따갖다 쓰는 거야?
105,죄다 땅만 파 제끼고오~~ 가로등도 안 고치고오~~
106,"이러다가 사고나믄, 뭐 지드리 책임 질거냐ㄱ... 어, 어?”"
107,빗물에 젖어 발을 내디딜 때 마다 찍찍 소리를 내던 삼선 슬리퍼 한 짝이 허공을 날았다.
108,"“으, 으아아아아아아ㄱ!!!!”"
109,동시에 들고 있던 우산을 패대기치며 있는 힘껏 양 팔을 퍼덕거려보았지만 모두가 헛짓이었다.
110,쿵!!!!
111,.
112,.
113,.
114,.
115,.
116,.
117,.
118,"[30대 여성 박 모 씨, 집 앞 맨홀 추락사."
119,음주 상태였던 것으로 밝혀져... ]
120,내일 아침 뉴스에 두 줄 정도는 나오려나.
121,안전 불감증이 지병인 빌어먹을 대한민국.
122,어떻게 가이드라인 하나 없이 맨홀 뚜껑을 열어둘 수 있는 거냐고.
123,나... 진짜 이렇게 가는 거야?
124,아니 여봐요.
125,인생 마감까지 시궁창에서 시킬 필요는 없는 거잖아요...
126,하느님이든 염라대왕이든 뭐가 됐든 내가 딱하지도 않으신가?
127,전신이 불에 타는 것처럼 뜨거운데 그게 어디서 느껴지는 통증인지 가늠이 되지 않았다.
128,눈두덩이 위로는 뜨끈하고 축축한 것이 흘렀는데 아마 빗물은 아닐 테지.
129,귀에서는 이명도 들렸다.
130,미친 듯이 무섭고 두려운데...진짜 무서운데...
131,갑자기 웃음이 입가를 비집고 나왔다.
132,이게 내 삶의 끝이고 완성이라 생각하니 너무 비참해서.
133,너무 어이가 없어서.
134,일그러진 입매로 실실거리다 눈을 감았다.
135,‘졸려... ’
136,영화에서 이러다 잠들면 다 죽던데.
137,진짜 끝이다.
138,그렇게 나는 32년의 짧고 실낱같이 가늘었던 생을 마감했다.
139,.
140,.
141,.
142,"아니, 그런 줄 알았다."
143,그 남자와 마주하기 전까지는.
144,“깼군.”
145,어이가 없네
146,
147,“깼군.”
148,허억!!
149,심장이 목젖을 때리는 느낌을 경험해 본 적 있는가.
150,어찌나 놀랐는지 숨이 목구멍을 차고 올라와 안구까지 뻐근했다.
151,‘뭔 놈의 눈빛이... ’
152,나를 내려다보는 남자의 시선에 오금이 저렸다.
153,곧 누구 하나 죽일 것 같이 냉기가 뚝뚝 흐르는 게...
154,내게 건넨 말이‘깼군’이 아니라‘배고파’였다면 나를 씹어 먹으려는 줄 알았을 것이다.
155,죽다 살아났는데 눈 뜨자마자 생명을 위협을 느끼는 지금 이 상황이 심히 당황스러웠다.
156,"게다가 저 남자, 딱 봐도 외국인이다."
157,"깎아놓은 듯한 이목구비에 은빛 머리, 금빛 눈동자."
158,그런데 저 사람이 내게 말을 했지. 그의 언어로.
159,난 그걸 알아들었고.
160,... 이거 꿈인가?
161,벌렁대는 심장을 진정시키며 정신을 가다듬었다.
162,누워있지만 생각보다 가벼운 몸 상태.
163,가슴께에 걸쳐진 이불 속으로 숨어있는 손가락 발가락을 꼼지락거려보았다.
164,"‘사지 말짱하고, 정신도 말짱하고.’"
165,꿈은 아니다.
166,몸에 닿아있는 침구의 감촉이 무척 부드러웠다.
167,엉덩이에 느껴지는 침대의 쿠션감도 훌륭했고 실내 공기는 쾌적했다.
168,모든 감각이 생생했다.
169,그래서 문제였다.
170,당최 이게 무슨 일이야.
171,여긴 어디지? 병원은 아닌 게 확실한데.
172,그리고 저 남자는 대체 누구야!
173,당사자에게 물어보고 싶었지만 입이 떨어지지 않았다.
174,아직 그의 시선이 나를 찢어발길 듯 날카로웠다.
175,어디 다른 사람은 없나?
176,고개를 살짝 틀어 반쯤 열린 침대 캐노피 바깥쪽으로 시야를 넓혔다.
177,좌측 벽에 붙어있는 고풍스러운 촛대와 우측에 보이는 원목 티 테이블이 전부인 인테리어는 단출하면서도 이국적이었다.
178,"그리고 그 이국적 느낌을 배가시키는 두 명의 중년 남자, 그리고 앳되어 보이는 여자 하나가 보였다."
179,"전형적인 서양인의 외모에 그린, 브라운, 오렌지레드까지."
180,머리색이 각양각색인 그들의 시선이 나를 향해 있었다.
181,질문에 앞서 인사는 해야겠지. 나보다 나이 많은 분도 계시는데.
182,“저... 안녕하세요?”
183,“... 미친 짓만 벌인 게 아니라 진짜로 미친 건가? ”
184,뭐요?
185,"은빛 머리 당신, 다짜고짜 말이 너무 심하시네."
186,나랑 별 차이도 없어 보이는데 언제 봤다고 반말을 찍찍 해대...?!!
187,"아니 그런데 잠깐, 잠깐만."
188,좀 전에 내 입에서 나온 말 그거...뭐지?
189,저 남자도 그렇고. 대체 어느 나라 말이야?
190,근데 이걸 또 내가... 자연스럽게 쓰고 있네 맙소사.
191,어이없는 상황에 누인 몸을 일으키려 팔다리에 힘을 썼다.
192,하지만 절반쯤 일으키다 도로 눕고 말았다.
193,배가 당기고 현기증이나 구역감이 일었다.
194,“우욱!”
195,무심결에 입을 틀어막은 손.
196,그런데 그 손이... 무척 가늘었다.
197,"희고 가느다란 손가락, 그리고 팔목."
198,그 위에 흘러내린 푸른색 머리카락.
199,내 것이었다.
200,허!
201,나 진짜 미친 거야?
202,“당신 표정이 이렇게 다채로운 줄 미처 몰랐군.
203,그런데 미리 경고하지. 생각 따위 하지 마.
204,내가 듣고 싶은 건 변명이 아니라 진실이니까.”
205,“거울... 거울 좀 주세요.”
206,“진실을 말하는 데 그게 필요한가?”
207,"“네, 필요해요. 지금 당장.”"
208,내 속사포 같은 대답에 그 남자의 눈썹이 꿈틀댔지만 상관없었다.
209,"지금 이 순간, 나는 내 몸뚱이가 더 두려웠다."
210,남자가 고갯짓을 하자 보라색 캐노피에 반쯤 가려져 있던 중년 남자가 다가왔다.
211,반듯하게 빗어 넘긴 갈색 머리와 가지런한 콧수염이 인상적이었다.
212,"“마님, 워낙 상황이 다급해 별채로 모신지라... 쓰시던 거울이 아님을 용서하십시오.”"
213,오 맙소사! 날 보고 마님이란다.
214,공손히 모아 잡은 중년 남자의 손에서 거울을 뺏다시피 낚아채 비춰본 얼굴은 예상했던 것처럼 내가 아니었다.
215,아마 그 마님이란 여자일 테지.
216,희다 못해 창백한 피부에 짙은 다크써클과 짓이겨진 듯 터진 입술.
217,그 위로 헝클어진 푸른색 머리카락이 몇 가닥 내려앉아 있었다.
218,"검은 중단발에 희미한 눈썹, 살짝 쳐진 눈꼬리."
219,그게 나인데. 박서연인데.
220,내가 왜... 이 여자의 몸으로 깨어난 거지?
221,내 몸은?
222,일순간 온몸의 힘이 풀렸다.
223,들고 있던 거울을 침대 머리맡으로 내려놓자 은발의 남자가 침대로 바짝 다가섰다.
224,“볼 일은 끝난 것 같은데.
225,이제 말해. 어젯밤 호수정원에서 무슨 일이 있었는지.”
226,“...... ”
227,“내가 그 입을 강제로 열게 하는 일은 없었으면 좋겠군.”
228,“...... ”
229,“혹시 당신 아버지와 관련이 있나?”
230,“그만!”
231,혼란의 쓰나미. 혼돈의 카오스.
232,그야말로 노답 상황인 나에게 자꾸 뭘 말하라는 건지.
233,이 남자야 제발 좀 닥쳐!
234,해줄 말은 없었지만 계속 무시하면 저 닦달을 멈추지 않겠지.
235,옆으로 몸을 틀어 낑낑대며 상체를 일으키자 캐노피 바깥쪽에서 상황을 지켜보던 붉은 머리의 여자가 다가와 침대 헤드에 베개를 받쳐주곤 다시 제 자리로 물러났다.
236,제일 가까이 있었으면서.
237,아픈 사람은 도와줘야 한다는 걸 모르는 못 배운 놈이 분명했다.
238,아니면 이 몸과 앙숙이거나.
239,여전히 냉랭한 눈빛으로 나를 추궁하던 남자에게 말했다.
240,“내게 듣고 싶은 게 뭐든 난 말해줄 수가 없어요.”
241,“왜지?”
242,“모르니까요.”
243,“... 난 당신에게 퀴즈 따위를 낸 게 아니야 로즐린.
244,"어젯밤 당신에게 생긴 일 아니, 당신이 벌인 일에 대해서 묻고 있는 거지.”"
245,그러니까 모른다고 이 자식아!!
246,이 몸의 이름도 방금 알았거든?
247,"로즐린이 아니라 실은 박서연이라는 사람이라고, 몸이 바뀌어서 나도 무척 당황스럽다는 둥의 말을 꺼내는 순간 이 작자는 나를 정신병원에 처박아 버릴지도 몰라."
248,"아, 진짜 이걸 사실대로 말할 수도 없고."
249,거짓말을 하자니 뭘 쥐뿔 알아야 둘러대기라도 하지.
250,.
251,.
252,.
253,결국 이 수밖에 없나.
254,출생의 비밀 다음으로 내가 싫어하던 설정!
255,그 밤고구마 X100 같은 설정을 몸소 실천하는 날이 오다니.
256,“기억이... 없어요.”
257,“고작 하루 전 일이 기억에 없다?
258,"하, 내가 당신 남편인건 기억하나?”"
259,“거짓말이 아니에요. 정말이에요.
260,머릿속 기억이 몽땅 사라진 것처럼... 없어요. 아무것도.
261,"내 이름이 로즐린이라는 것도, 당신이 내 남편이라는 것도."
262,... 도대체 어젯밤 저에게 무슨 일이 있었던 거죠?”
263,좋았어! 꽤 자연스러웠어.
264,아까와는 다른 쪽으로 심장이 벌렁벌렁했지만 나는 이겨냈다.
265,발연기의 벽을 무사히 넘었고 고지가 바로 눈앞이었다.
266,"그런데 망할, 저 작자가 이 몸의 남편이라고?"
267,“휘겐!”
268,"“예, 공작전하.”"
269,“살펴라.”
270,휘겐이라 불린 남자는 아마도 의사인 모양이다.
271,의료용 가위와 실 따위가 들어있는 검은색 가방을 들고 침대 가까이 다가왔다.
272,나는 기억상실 할거라서 그런 건 필요 없는데.
273,"“마님, 지금 기분은 좀 어떠십니까?”"
274,“좋진 않죠.”
275,“어디 불편하신 곳은 없으십니까?”
276,"“온 몸이 쑤시고, 머리도 아프고."
277,눈이 빠질 것 같이 뻐근하면서 속도 울렁거려요”
278,그러고 보니 이 로즐린이라는 여자는 왜 이렇게 몸 상태가 나쁜 거지?
279,부러지고 피나는 데만 없다 뿐이지 맨홀로 추락했었다고 해도 믿을 정도였다.
280,“어젯밤 호수정원에 가셨던 것은 기억이 나십니까?”
281,“아뇨.”
282,“그럼 이 중에 아는 얼굴은 있으십니까?”
283,“없어요.”
284,“공작전하의 존함은?”
285,“몰라요.”
286,“마님 본인의 이름은?”
287,“... 로즐린.”
288,“오!”
289,“아까 들은 건데요.”
290,“아... 그러십니까?”
291,"뭐야, 이 사짜의 향기는."
292,이러다 몸살감기라고 진단하는 건 아니겠지?
293,“아무래도 마님께서는 어제의 사고로 기억을 소실하신 것 같습니다.”
294,“... 확실한가?”
295,"“예, 전하께서도 느끼셨겠지만 지금의 마님은 이전의 마님과는 마치 다른 분 같은 어투와 행동을 보이고 계십니다. 이는 꾸며서 나올 수 있는 것이 아닙니다."
296,또한 머리가 어지럽고 구역감을 호소하시는 것도 머리에 충격을 크게 받았을 때 나타나는 후유증의 일종입니다.”
297,"오호라, 사짜가 아니라 심리의학박사셨군."
298,이럴 때 쐐기를 박아줘야지.
299,“그럼 이제 저는 어떻게 되는 거죠?
300,기억을... 영원히 찾지 못할 수도 있나요?”
301,“송구하오나 그걸 단정 지을 수가 없는 게 이 증상의 특징입니다.
302,"잃어버린 기억이 당장 내일 돌아올 수도, 아니면 일부만 돌아올 수도, 혹은 영원히 돌아오지 않을 수도 있습니다.”"
303,예쓰! 썩세스!
304,“방법이 전혀 없나?”
305,“현재로서는... 그렇습니다 전하.”
306,“어제의 진실이 기어이 묻힌다는 소리로군.”
307,“우선 불편한 몸을 회복시키고 마음의 안정을 찾으시는 것이 중요합니다.
308,기억이란 게 얽히고 설켜 있어 과거에 보거나 들었던 경험들을 반복하시다 되찾게 되는 경우도 간혹 있으니 말입니다.”
309,휘겐이라는 의사와 대화를 마친 남자가 몸을 돌려 내게 시선을 던졌다.
310,그 시선이 뭐랄까... 좀 묘했다.
311,냉랭함이 순간 아주 조금 옅어졌달까?
312,“공작... 전하?”
313,“처음이군. 당신이 나를 부르는 건.”
314,“...... ”
315,“당분간 바깥출입은 금지요.”
316,“...... ”
317,“대답은?”
318,"“... 네, 그러죠.”"
319,어차피 갈 데도 없다.
320,그래서 그의 다소 강압적인 말에도 긍정의 답을 했다.
321,“알베르! 나는 집무실로 가겠다. 마무리하도록.”
322,"“예, 전하. 곧 따르겠습니다."
323,남자는 내게서 멀어져 이내 방문을 열고 사라졌다.
324,"아, 이제 좀 긴장을 풀어도 되려나."
325,베개를 받쳤음에도 온몸이 쑤셔서 몸을 곧추세우고 있는 것이 고역이었다.
326,다시 누워보려 몸을 바지락대자 아까 나를 도와 몸을 일으켜주었던 그 붉은 머리의 여자가 또다시 부축해주었다.
327,행동이나 옷차림으로 봐서는 시녀인 것 같은데.
328,"침대에 도로 눕자 공작을 배웅했던 갈색머리 콧수염의 남자, 알베르라고 했던가?"
329,그가 내게 다가왔다.
330,"“마님, 당분간은 불편하시더라도 이곳 별채에서 머무시는 것이 어떠하십니까?"
331,지금 본성이 약간... 시끄러워 요양 하시기엔 이곳이 더 나을 듯 합니다.”
332,“전 여기도 상관없어요.
333,그런데 시끄럽다니. 무슨 일이 있나요?”
334,“... 그저 작은 소란입니다. 크게 신경 쓰실 만한 일은 아닙니다.”
335,"네, 그럼 신경 끌게요."
336,사실 예의상 물어본 거예요. 지금 제 코가 석자라.
337,"“레아, 너는 마님 곁에서 한시도 눈을 떼지 말고 세심히 살펴 드려야 한다. 또다시 이런 불미스러운 일이 일어난다면 그땐 너도 책임을 면치 못한다는 것을 잊지 말거라.”"
338,"“예, 알베르 집사님. 명심 하겠습니다.”"
339,"아, 드디어 아저씨들 퇴장."
340,레아라는 여자만 남겨두고 알베르 씨는 휘겐 씨와 함께 침실을 나갔다.
341,그들이 나가자 적막감에 휩싸인 방은 벽난로에 장작을 채워 넣으며 레아가 간혹 일으키는 작은 소음만이 들려왔다.
342,"자, 이제 어쩐다."
343,"차원이동, 빙의, 그리고 남편."
344,이 세 가지가 지금 내게 닥친 숙제다.
345,사실 너무 막막했다.
346,이 주관식 숙제를 풀기 위해서는 지금의 황당한 현실을 명확하게 설명해줄 조력자가 절실히 필요했다.
347,그리고 아주 다행스럽게도 그 조력자에 역할에 딱 맞는 적임자가 지금 내 가까이에 있었다.
348,반쯤 젖혀진 캐노피 밖으로 바지런히 움직이고 있는 동그란 뒤통수.
349,“레아!”
350,^^^
351,누구냐 넌
352,
353,“레아!”
354,"마님인 자신이 시녀에게 존대를 쓰는 게 퍽 이상할 것 같기도 하고, 말간 얼굴로 자신의 눈치를 보던 시녀가 제법 어려 보여서 반말로 운을 띄웠는데 내 부름을 듣고 고개를 돌린 그녀는 무척 놀란 듯 보였다."
355,벽난로에서 침대까지 몇 걸음이나 된다고.
356,쭈뼛쭈뼛 다가오는 폼이 영락없이 고양이 앞의 쥐였다.
357,아무래도 마님과 시녀의 관계가 별로였던 모양이다.
358,하긴 갑과 을의 관계란 게 다 그렇지 뭐.
359,나에겐 오히려 잘된 일이었다.
360,둘 사이가 친밀했다면 불필요한 의심을 사지 않기 위해서라도 내 행동은 조심스러워 질 수밖에 없었을 테니까.
361,그나저나 저렇게 쫄아 있는 애를 대체 어떻게 구슬리나.
362,* * *
363,창밖 정원에는 3월의 따스한 햇살을 먹고 피기 시작한 꽃나무들이 가득했지만 레아는 불씨가 잦아드는 벽난로 속으로 장작을 채워 넣기에 분주했다.
364,밤새 오한발열에 시달리다 이제 막 의식을 찾은 제 주인이 흡족하도록 실내 공기부터 데워놓아야 했다.
365,그런데 생각지도 못한 음성이 저를 불렀다.
366,“레아!”
367,‘맙소사. 내가 잘못 들은 게 아니야.’
368,퍼뜩 소리가 난 방향으로 고개를 돌리자 초췌한 얼굴의 마님이 레아를 응시하고 있었다.
369,처음이었다.
370,마님께서 그녀의 이름을 부른 것이.
371,"“네, 네 마님. 레아 여기 있습니다. 말씀하세요.”"
372,“아까 들어서 알겠지만 내가 지금 아무것도 기억하지 못해서...
373,그래서 네 도움이 필요해.
374,"지금 내가 알고 있는 건 내 이름과 네 이름, 그리고 여기가 공작성이라는 것뿐이거든."
375,난... 어떤 사람이었니?”
376,"기억상실로 인해 마님의 말과 행동이 이전과 달라졌음을 이미 목격한 레아였지만, 그 변화의 여파가 제게도 직접적으로 미치리라는 것까지는 미처 생각지 못한 터였다."
377,조근 조근 상냥한 말투의 마님이라니.
378,때문에 제 주인의 물음에 마땅히 고개 숙여 즉각 답을 해야 했지만 레아는 잠시 동안 얼빠진 표정을 감추지 못하고 멍청히 서 있을 수밖에 없었다.
379,"“레아, 괜찮니?”"
380,"“아...송구합니다, 마님.”"
381,"낯설고도 다정한 마님의 목소리에 레아는 애써 당황스러움을 감춘 채, 자신이 알고 있는 것을 성심성의껏 답하기 시작했다."
382,그리고 그 답 속의 로즐린은 여타 평범한 귀족부인들과는 무척 거리가 멀었다.
383,"로즐린 아스트리드, 27세."
